{
  "$schema": "https://json-schema.org/draft/2020-12/schema",
  "$id": "https://fossil.local/contracts/holdout/public-suite-manifest-v1.schema.json",
  "title": "FOSSIL public hidden-acceptance suite manifest v1",
  "description": "Location-free public registry of logical sealed holdout suites and the public properties they cover. It contains no case identifiers/counts/content, private oracle details, credentials, executor identity, or private placement/access information.",
  "type": "object",
  "required": [
    "manifest_version",
    "receipt_schema_version",
    "suites",
    "sealed_material_in_public_repo",
    "private_placement_disclosed",
    "credentials_disclosed"
  ],
  "properties": {
    "manifest_version": {"const": "fossil.hidden-acceptance-manifest.v1"},
    "receipt_schema_version": {"const": "fossil.hidden-acceptance-aggregate.v1"},
    "suites": {
      "type": "array",
      "minItems": 1,
      "items": {
        "type": "object",
        "required": ["suite_id", "property_ids", "priority", "status"],
        "properties": {
          "suite_id": {
            "type": "string",
            "pattern": "^holdout_[a-z0-9][a-z0-9._-]{0,63}$"
          },
          "property_ids": {
            "type": "array",
            "minItems": 1,
            "uniqueItems": true,
            "items": {
              "type": "string",
              "pattern": "^FOSSIL-PROP-[A-Z0-9-]+$"
            }
          },
          "priority": {"enum": ["critical", "high"]},
          "status": {"enum": ["planned", "active", "blocked"]}
        },
        "additionalProperties": false
      }
    },
    "sealed_material_in_public_repo": {"const": false},
    "private_placement_disclosed": {"const": false},
    "credentials_disclosed": {"const": false}
  },
  "additionalProperties": false
}
